<?xml version="1.0" encoding="UTF-8" ?>
<!DOCTYPE application
    PUBLIC "-//mybatis.org//DTD Config 4.0//EN"
        "mybatis-application-1.dtd">

<application name="minimal">

    <environments>
        <environment id="local">
            <hikaricp id="rtomde">
                <driverClassName>com.mysql.cj.jdbc.Driver</driverClassName>
                <jdbcUrl>jdbc:mysql://localhost:3306/rtomde</jdbcUrl>
                <username>root</username>
                <password>123</password>
                <profileSQL>true</profileSQL>
            </hikaricp>
            <lettuce id="11">
                <redisURI></redisURI>
            </lettuce>
        </environment>
        <environment id="dev">
            <hikaricp id="rtomde">
                <driverClassName>com.mysql.cj.jdbc.Driver</driverClassName>
                <jdbcUrl>jdbc:mysql://localhost:3306/rtomde</jdbcUrl>
                <username>root</username>
                <password>123</password>
                <profileSQL>true</profileSQL>
            </hikaricp>
            <lettuce id="11">
                <redisURI></redisURI>
            </lettuce>
        </environment>
    </environments>

    <mappers>
        <mapper url="file:/Users/wangqi/Documents/git_repository/rtomde/rtomde-jdbc/src/test/java/org/apache/ibatis/session/SysUserMapper.xml"/>
    </mappers>

</application>


