<?xml version="1.0" encoding="UTF-8" ?>
<!DOCTYPE application
    PUBLIC "-//sliew.cn//DTD Application 1.0//EN"
    "http://sliew.cn/dtd/mybatis-application-1.dtd">

<application name="rtomde">
    <properties>
        <property name="prop1" value="bbbb"/>
    </properties>

    <typeAliases>
        <typeAlias alias="Integer" type="java.lang.Integer" />
        <typeAlias alias="Long" type="java.lang.Long" />
        <typeAlias alias="HashMap" type="java.util.HashMap" />
        <typeAlias alias="LinkedHashMap" type="java.util.LinkedHashMap" />
        <typeAlias alias="ArrayList" type="java.util.ArrayList" />
        <typeAlias alias="LinkedList" type="java.util.LinkedList" />
    </typeAliases>

    <environments>
        <environment id="dev">
            <hikaricp id="data_service">
                <jdbcUrl>jdbc:mysql://localhost:3306/data_center</jdbcUrl>
                <username>root</username>
                <password>123</password>
                <driverClassName>com.mysql.cj.jdbc.Driver</driverClassName>
                <profileSQL>true</profileSQL>
            </hikaricp>
            <lettuce id="dev">
                <redisURI>redis://123@localhost:6379/0?timeout=1s</redisURI>
            </lettuce>
        </environment>
    </environments>

</application>


